{
  "id": "svampar",
  "name": "Bra svampar att känna till",
  "description": "Urval av bra matsvampar och några giftiga",
  "speciesIds": [
  "trollsmor",
  "stenmurkla",
  "monjeskal",
  "vartig-roksvamp",
  "skalroksvamp",
  "blek-taggsvamp",
  "rodgul-taggsvamp",
  "en-gul-fingersvamp",
  "druvfingersvamp",
  "gullhorn",
  "blomkalssvamp",
  "kantarell",
  "blek-kantarell",
  "narrkantarell",
  "trattkantarell",
  "rodgul-trumpetsvamp",
  "svart-trumpetsvamp",
  "porer-av-orsopp",
  "svavelticka",
  "farticka",
  "tegelsopp",
  "aspsopp",
  "bjorksopp",
  "smorsopp",
  "grynsopp",
  "sandsopp",
  "brunsopp",
  "stensopp",
  "gul-svampsnylting",
  "gallsopp",
  "tegelkremla",
  "vinkremla",
  "gulkremla",
  "giftkremla",
  "gulmjolkig-ekriska",
  "granblodriska",
  "tallblodriska",
  "skaggriska",
  "vit-flugsvamp",
  "lomsk-flugsvamp",
  "rod-flugsvamp",
  "brun-kamskivling",
  "stolt-fjallskivling",
  "honungsskivling",
  "scharlakansrod-vaxskivling",
  "sotvaxskivling",
  "kastanjemusseron",
  "riddarmusseron",
  "dropptrattskivling",
  "gifttrattskivling",
  "en-spindelskivling",
  "rynkad-tofsskivling",
  "tuvspindelskivling",
  "bockspindelskivling",
  "toppig-giftspindelskivling",
  "rodskivig-kanelspindelskivling",
  "pluggskivling",
  "snobollschampinjon",
  "kungschampinjon",
  "karbolchampinjon",
  "fjallig-blacksvamp",
  "gra-blacksvamp",
  "citrongul-slemskivling",
  "rokSlojskivling",
  "en-hatta",
  "gra-brokskivling",
  "stubb-blacksvamp",
  "eksopp",
  "sillkremla"
]
}
