{
  "id": "faglar-sodra-sverige",
  "name": "Fåglar man bör kunna i södra Sverige",
  "description": "Några utvalda arter man bara måste kunna i södra Sverige",
  "speciesIds": [
    "parus-major",
    "cyanistes-caeruleus",
    "sitta-europaea",
    "passer-montanus",
    "passer-domesticus",
    "pyrrhula-pyrrhula",
    "chloris-chloris",
    "fringilla-coelebs",
    "fringilla-montifringilla",
    "dendrocopos-major",
    "turdus-merula",
    "erithacus-rubecula",
    "spinus-spinus",
    "carduelis-carduelis",
    "coccothraustes-coccothraustes",
    "poecile-palustris",
    "poecile-montanus",
    "periparus-ater",
    "lophophanes-cristatus",
    "aegithalos-caudatus",
    "emberiza-citrinella",
    "garrulus-glandarius",
    "pica-pica",
    "coloeus-monedula",
    "turdus-pilaris",
    "acanthis-flammea",
    "streptopelia-decaocto",
    "prunella-modularis",
    "certhia-familiaris",
    "picus-viridis"
  ]
}
