{
  "id": "insekter-skog-syd",
  "name": "Vanliga insekter i skog södra Sverige",
  "description": "50 vanliga arter kopplade till skogsmiljöer i södra Sverige.",
  "speciesIds": [
    "ips-typographus",
    "tomicus-piniperda",
    "carabus-nemoralis",
    "monochamus-sutor",
    "chrysolina-fastuosa",
    "otiorhynchus-sulcatus",
    "gnorimus-variabilis",
    "staphylinus-olens",
    "agriotes-lineatus",
    "melolontha-melolontha",
    "dytiscus-marginalis",
    "cis-boleti",
    "aglais-urticae",
    "gonepteryx-rhamni",
    "polygonia-c-album",
    "pieris-brassicae",
    "melitaea-athalia",
    "operophtera-brumata",
    "autographa-gamma",
    "apatura-iris",
    "aglais-io",
    "argynnis-aglaja",
    "musca-domestica",
    "lipoptena-cervi",
    "hypoderma-bovis",
    "culex-pipiens",
    "lucilia-sericata",
    "syrphus-ribesii",
    "tabanus-bromius",
    "mycetophila-fungorum",
    "apis-mellifera",
    "vespula-vulgaris",
    "formica-rufa",
    "ichneumon-suspiciosus",
    "bombus-terrestris",
    "dolichovespula-saxonica",
    "formica-fusca",
    "palomena-prasina",
    "lygaeus-equestris",
    "philaenus-spumarius",
    "cicadella-viridis",
    "gerris-lacustris",
    "chorthippus-parallelus",
    "coenagrion-puella",
    "aeshna-grandis",
    "ephemera-vulgata",
    "nemoura-cinerea",
    "limnephilus-flavicornis",
    "forficula-auricularia",
    "lepisma-saccharinum"
  ]
}
