{
  "id": "insekter-syd",
  "name": "Vanliga insekter i södra Sverige",
  "description": "Urval av arter typiska för södra Sverige",
  "speciesIds": [
    "apis-mellifera",
    "bombus-terrestris",
    "vespula-vulgaris",
    "dolichovespula-rufa",
    "formica-rufa",
    "lasius-niger",
    "musca-domestica",
    "tabanus-bovinus",
    "simuliidae",
    "culex-pipiens",
    "coccinella-septempunctata",
    "carabus-nemoralis",
    "geotrupes-stercorarius",
    "melolontha-melolontha",
    "cetonia-aurata",
    "aglais-urticae",
    "aglais-io",
    "gonepteryx-rhamni",
    "pieris-brassicae",
    "polygonia-c-album",
    "dolycoris-baccarum",
    "lygaeidae",
    "aphididae",
    "chorthippus-brunneus",
    "gryllus-campestris",
    "forficula-auricularia",
    "lepisma-saccharinum",
    "philaenus-spumarius",
    "gerris-lacustris",
    "tettigonia-viridissima"
  ]
}
