{
  "id": "alger-syd",
  "name": "Vanliga alger i södra Sverige",
  "description": "Urval av arter typiska för södra Sverige",
  "speciesIds": [
    "fucus-vesiculosus",
    "fucus-serratus",
    "fucus-spiralis",
    "ascophyllum-nodosum",
    "laminaria-hyperborea",
    "laminaria-digitata",
    "saccharina-latissima",
    "himanthalia-elongata",
    "chorda-filum",
    "halidrys-siliquosa",
    "elachista-fucicola",
    "sphacelaria-cirrosa",
    "sargassum-muticum",
    "ulva-lactuca",
    "ulva-intestinalis",
    "cladophora-glomerata",
    "bryopsis-plumosa",
    "corallina-officinalis",
    "furcellaria-lumbricalis",
    "polysiphonia-spp",
    "polysiphonia-elongata",
    "ceramium-tenuicorne",
    "rhodomela-confervoides",
    "palmaria-palmata",
    "chondrus-crispus",
    "delesseria-sanguinea",
    "polyides-rotunda"
  ]
}
